{"$schema":"https://json-schema.org/draft/2020-12/schema","$id":"https://aese.local/schemas/experiment-definition.schema.json","type":"object","additionalProperties":false,"required":["schema_version","code","tenant","checkpoint","parent_hash","horizon_weeks","profiles","policies","seeds","rules_version","prng_version"],"properties":{"schema_version":{"const":"1.0"},"code":{"type":"string","pattern":"^EXP-GENESIS-M14-"},"tenant":{"const":"tenant-hctm"},"checkpoint":{"const":"first_commercial_cycle_closed"},"parent_hash":{"type":"string","minLength":8},"horizon_weeks":{"const":12},"profiles":{"type":"array","minItems":1,"uniqueItems":true,"items":{"enum":["nominal","demand-spike","supplier-risk","equipment-risk","cash-delay"]}},"policies":{"type":"array","minItems":3,"items":{"type":"object","additionalProperties":false,"required":["code","safety_stock","dual_source_pct","maintenance_gate","overtime_limit","cash_buffer_cny"],"properties":{"code":{"enum":["baseline","lean","resilient"]},"safety_stock":{"type":"integer","minimum":0,"maximum":2400},"dual_source_pct":{"type":"integer","minimum":0,"maximum":50},"maintenance_gate":{"type":"integer","minimum":0,"maximum":100},"overtime_limit":{"type":"integer","minimum":0,"maximum":2400},"cash_buffer_cny":{"type":"integer","minimum":0}}}},"seeds":{"type":"array","minItems":1,"maxItems":8,"uniqueItems":true,"items":{"type":"integer","minimum":1}},"rules_version":{"const":"experiment-rules-1.0.0"},"prng_version":{"const":"sha256-counter-v1"}}}
