{"schema_version":"1.0","code":"EXP-GENESIS-M14-001","tenant":"tenant-hctm","checkpoint":"first_commercial_cycle_closed","parent_hash":"m13:9af75fd1cdaef617","horizon_weeks":12,"profiles":["nominal","demand-spike","supplier-risk","equipment-risk","cash-delay"],"policies":[{"code":"baseline","safety_stock":600,"dual_source_pct":0,"maintenance_gate":75,"overtime_limit":1200,"cash_buffer_cny":3000000},{"code":"lean","safety_stock":150,"dual_source_pct":0,"maintenance_gate":85,"overtime_limit":800,"cash_buffer_cny":2500000},{"code":"resilient","safety_stock":1200,"dual_source_pct":30,"maintenance_gate":65,"overtime_limit":1800,"cash_buffer_cny":4000000}],"seeds":[1103,2207,3301,4409],"rules_version":"experiment-rules-1.0.0","prng_version":"sha256-counter-v1"}
